sujet,date,statut
Comment les peintres almoravides stylisaient-ils les palmiers dans leurs décors architecturaux ?,2025-10-15T06:04:40.153287,succès
Les paysages des dessus de boîtes en émail représentaient-ils des villégiatures aristocratiques ?,2025-10-20T08:50:49.611565,succès
Pourquoi Pynacker intégrait-il des éléments exotiques dans ses paysages italianisants ?,2025-10-27T08:53:00.624687,succès
Comment les estampes de paysage servaient-elles de documentation pour les peintres n'ayant jamais voyagé ?,2025-11-03T09:01:16.970757,succès
Comment les marchands vénitiens du XVe siècle valorisaient-ils les paysages dans leurs inventaires ?,2025-11-10T08:54:10.538382,succès
Pourquoi les paysages hollandais du XVIIe siècle se vendaient-ils moins cher que les portraits ?,2025-11-17T08:28:48.001571,succès
Quelle est la relation entre colonialisme et représentation des paysages exotiques ?,2025-11-24T08:28:35.239575,succès
Comment les manufactures de papier peint panoramique révolutionnent-elles l'accès au paysage décoratif ?,2025-12-01T08:31:13.290102,succès
Pourquoi les collectionneurs britanniques du XVIIIe siècle privilégiaient-ils les vues italiennes ?,2025-12-08T08:31:18.004105,succès
Quelle technique de reproduction permettait de diffuser massivement les paysages romantiques ?,2025-12-15T08:32:30.024709,succès
Comment les compagnies ferroviaires américaines financent-elles les peintures de paysages de l'Ouest ?,2025-12-22T08:29:54.676236,succès
Pourquoi les kakémonos japonais de paysage circulaient-ils selon des circuits commerciaux précis ?,2025-12-29T08:31:39.147668,succès
Quelle est l'influence des guildes flamandes sur la standardisation des formats de paysages ?,2026-01-05T08:32:49.856595,succès
Comment les peintres itinérants scandinaves du XIXe siècle diffusaient-ils leurs vues de fjords ?,2026-01-12T08:31:47.146298,succès
Pourquoi les paysages nocturnes étaient-ils plus rares et donc plus coûteux au XVIIe siècle ?,2026-01-19T08:32:51.682247,succès
Comment les expositions universelles du XIXe siècle transforment-elles le marché du paysage ?,2026-01-27T07:25:40.951268,succès
Pourquoi les peintres de marines recevaient-ils des commandes des compagnies maritimes ?,2026-02-01T07:35:56.640661,succès
Quelle technique de copie permettait aux ateliers chinois de produire des paysages en série ?,2026-02-02T07:48:16.471187,succès
Comment le tourisme alpin crée-t-il un marché pour les vues de montagne au XIXe siècle ?,2026-02-03T07:41:19.377286,succès
Pourquoi certains paysages de Constable valent-ils aujourd'hui cent fois plus qu'à son époque ?,2026-02-04T07:42:55.613452,succès
Quelle est l'origine des paysages peints sur éventails dans la culture japonaise ?,2026-02-05T07:48:17.031279,succès
Comment les marchands d'estampes japonaises établissaient-ils les prix des séries de paysages ?,2026-03-01T07:38:40.989964,succès
